{
  "schema_version": 1,
  "base_sha": "aaaaaaaaaaaaaaaaaaaaaaaaaaaaaaaaaaaaaaaa",
  "first_parent_commits": [
    {
      "sha": "508bca7c302c8a5e1b5214d5b03d243de6965ac6",
      "parent_sha": "a146073000000000000000000000000000000000",
      "tree_sha": "1111111111111111111111111111111111111111",
      "subject": "fw 1.0.5"
    },
    {
      "sha": "b98ef489614e9c6d98af70020f1adaaf36b1630b",
      "parent_sha": "508bca7c302c8a5e1b5214d5b03d243de6965ac6",
      "tree_sha": "2222222222222222222222222222222222222222",
      "subject": "rtc ota"
    },
    {
      "sha": "aaaaaaaaaaaaaaaaaaaaaaaaaaaaaaaaaaaaaaaa",
      "parent_sha": "b98ef489614e9c6d98af70020f1adaaf36b1630b",
      "tree_sha": "eeeeeeeeeeeeeeeeeeeeeeeeeeeeeeeeeeeeeeee",
      "subject": "squash text is not release authority",
      "pull_request": {
        "number": 41,
        "title": "feat(sensor): add calibrated readings",
        "url": "https://github.com/Jan-IngenHousz-Institute/ambyte-iot/pull/41"
      }
    }
  ],
  "release_tags": [
    {
      "name": "v1.0.5",
      "target_sha": "508bca7c302c8a5e1b5214d5b03d243de6965ac6",
      "published": true,
      "immutable": true
    }
  ],
  "recovery_markers": []
}
